{
  "$schema": "https://json-schema.org/draft/2020-12/schema",
  "$id": "https://cropcard.dev/schemas/herbicide.schema.json",
  "title": "CropCard Herbicide Plugin",
  "description": "Data-only herbicide definition. Mirrors apps/web/src/lib/plugins/schemas.ts (herbicidePluginSchema). complianceFlags (Phase 21) drives the philosophy filter on the Inputs Plan step.",
  "type": "object",
  "properties": {
    "pluginId": {
      "type": "string",
      "pattern": "^[a-z0-9][a-z0-9-]{0,63}$"
    },
    "displayName": {
      "type": "string",
      "minLength": 1,
      "maxLength": 120
    },
    "version": {
      "type": "string",
      "minLength": 1
    },
    "pluginSchemaVersion": {
      "type": "string",
      "enum": [
        "1.0",
        "1.1"
      ]
    },
    "type": {
      "type": "string",
      "const": "herbicide"
    },
    "activeIngredients": {
      "minItems": 1,
      "type": "array",
      "items": {
        "type": "object",
        "properties": {
          "name": {
            "type": "string",
            "minLength": 1
          },
          "chemistryClass": {
            "type": "string",
            "enum": [
              "synthetic-auxin",
              "chloroacetamide",
              "hppd-inhibitor",
              "accase-inhibitor",
              "glyphosate",
              "sulfonylurea",
              "microtubule-inhibitor",
              "photosystem-ii-triazine",
              "photosystem-i-diquat",
              "glufosinate",
              "ppo-inhibitor",
              "als-imidazolinone",
              "vlcfa-pyroxasulfone",
              "clomazone",
              "unclassified"
            ]
          }
        },
        "required": [
          "name",
          "chemistryClass"
        ],
        "additionalProperties": false
      }
    },
    "defaultUnit": {
      "type": "string",
      "enum": [
        "fl-oz",
        "pt",
        "qt",
        "gal",
        "oz",
        "lb",
        "kg",
        "g",
        "count"
      ]
    },
    "formulation": {
      "type": "string",
      "enum": [
        "EC",
        "SL",
        "SC",
        "F",
        "L",
        "ME",
        "ES",
        "EW",
        "CS",
        "OD",
        "SE",
        "ZC",
        "WDG",
        "WG",
        "DF",
        "SG",
        "SP",
        "WP",
        "WSP",
        "WS",
        "G",
        "D"
      ]
    },
    "applicationTiming": {
      "type": "string",
      "enum": [
        "BURNDOWN",
        "PRE",
        "POST",
        "POST-DIRECTED"
      ]
    },
    "ratePerAcre": {
      "type": "object",
      "properties": {
        "amount": {
          "type": "number",
          "exclusiveMinimum": 0
        },
        "unit": {
          "type": "string",
          "enum": [
            "oz",
            "fl-oz",
            "lb",
            "pt",
            "qt"
          ]
        }
      },
      "required": [
        "amount",
        "unit"
      ],
      "additionalProperties": false
    },
    "rateProvenance": {
      "type": "string",
      "enum": [
        "label",
        "fallback"
      ]
    },
    "reEntryIntervalHours": {
      "type": "integer",
      "minimum": 0,
      "maximum": 9007199254740991
    },
    "preHarvestIntervalDays": {
      "type": "integer",
      "minimum": 0,
      "maximum": 9007199254740991
    },
    "preHarvestIntervalsByCrop": {
      "type": "array",
      "items": {
        "type": "object",
        "properties": {
          "cropPluginId": {
            "type": "string",
            "minLength": 1
          },
          "cropFamily": {
            "type": "string",
            "enum": [
              "corn",
              "cucurbit",
              "legume",
              "broadleaf-companion",
              "orchard",
              "cover-grass",
              "cover-legume",
              "solanaceae",
              "brassica",
              "allium",
              "leafy-green",
              "root",
              "apiaceae",
              "small-fruit",
              "bramble",
              "vine-fruit",
              "stone-fruit",
              "cereal-grain",
              "forage",
              "herb-culinary",
              "forage-grass",
              "perennial-vegetable"
            ]
          },
          "preHarvestIntervalDays": {
            "type": "integer",
            "minimum": 0,
            "maximum": 9007199254740991
          }
        },
        "required": [
          "preHarvestIntervalDays"
        ],
        "additionalProperties": false
      }
    },
    "gpaCalibration": {
      "default": 15,
      "type": "integer",
      "minimum": 0,
      "maximum": 9007199254740991
    },
    "dilutionTable": {
      "type": "object",
      "propertyNames": {
        "type": "string",
        "pattern": "^\\d+gal$"
      },
      "additionalProperties": {
        "type": "object",
        "properties": {
          "amount": {
            "type": "number",
            "exclusiveMinimum": 0
          },
          "unit": {
            "type": "string",
            "enum": [
              "oz",
              "fl-oz",
              "lb",
              "pt",
              "qt"
            ]
          },
          "display": {
            "type": "string"
          }
        },
        "required": [
          "amount",
          "unit"
        ],
        "additionalProperties": false
      }
    },
    "acresPerTank": {
      "type": "object",
      "propertyNames": {
        "type": "string",
        "pattern": "^\\d+gal$"
      },
      "additionalProperties": {
        "type": "number",
        "exclusiveMinimum": 0
      }
    },
    "requiresAMS": {
      "type": "boolean"
    },
    "deconRequired": {
      "type": "boolean"
    },
    "tankMixOrder": {
      "type": "integer",
      "minimum": 1,
      "maximum": 10
    },
    "epaRegistrationNumber": {
      "type": "string",
      "pattern": "^\\d{1,6}-\\d{1,6}(-\\d{1,6})?$"
    },
    "ratesPerZone": {
      "type": "array",
      "items": {
        "type": "object",
        "properties": {
          "zone": {
            "type": "string",
            "minLength": 1
          },
          "amount": {
            "type": "number",
            "exclusiveMinimum": 0
          },
          "unit": {
            "type": "string",
            "enum": [
              "oz",
              "fl-oz",
              "lb",
              "pt",
              "qt"
            ]
          },
          "notes": {
            "type": "string"
          }
        },
        "required": [
          "zone",
          "amount",
          "unit"
        ],
        "additionalProperties": false
      }
    },
    "traitGatedSafeFor": {
      "type": "array",
      "items": {
        "type": "object",
        "properties": {
          "cropPluginId": {
            "type": "string"
          },
          "requiresTraits": {
            "minItems": 1,
            "type": "array",
            "items": {
              "type": "string",
              "pattern": "^[a-z0-9][a-z0-9-]{0,63}$"
            }
          }
        },
        "required": [
          "cropPluginId",
          "requiresTraits"
        ],
        "additionalProperties": false
      }
    },
    "labelClaims": {
      "type": "object",
      "properties": {
        "safeForCropPluginIds": {
          "type": "array",
          "items": {
            "type": "string"
          }
        }
      },
      "additionalProperties": false
    },
    "complianceFlags": {
      "type": "object",
      "properties": {
        "omriListed": {
          "type": "boolean"
        },
        "nonGmoCompliant": {
          "type": "boolean"
        },
        "certifiedOrganicAllowed": {
          "type": "boolean"
        },
        "transitioningAllowed": {
          "type": "boolean"
        },
        "notes": {
          "type": "string",
          "maxLength": 500
        }
      },
      "additionalProperties": false
    },
    "grazingRestrictions": {
      "type": "object",
      "properties": {
        "grazeDays": {
          "type": "integer",
          "minimum": 0,
          "maximum": 3650
        },
        "hayDays": {
          "type": "integer",
          "minimum": 0,
          "maximum": 3650
        },
        "lactatingDairyGrazeDays": {
          "type": "integer",
          "minimum": 0,
          "maximum": 3650
        },
        "meatAnimalRemovalBeforeSlaughterDays": {
          "type": "integer",
          "minimum": 0,
          "maximum": 3650
        },
        "speciesExceptions": {
          "maxItems": 20,
          "type": "array",
          "items": {
            "type": "object",
            "properties": {
              "speciesId": {
                "type": "string",
                "pattern": "^[a-z0-9][a-z0-9-]{0,63}$"
              },
              "lactating": {
                "type": "boolean"
              },
              "grazeDays": {
                "type": "integer",
                "minimum": 0,
                "maximum": 3650
              },
              "hayDays": {
                "type": "integer",
                "minimum": 0,
                "maximum": 3650
              }
            },
            "required": [
              "speciesId"
            ],
            "additionalProperties": false
          }
        },
        "notForPasture": {
          "type": "boolean"
        },
        "manureCarryover": {
          "type": "boolean"
        },
        "manureCarryoverDays": {
          "type": "integer",
          "minimum": 0,
          "maximum": 3650
        },
        "hayOffFarmRestricted": {
          "type": "boolean"
        },
        "source": {
          "type": "string",
          "minLength": 1,
          "maxLength": 300
        }
      },
      "required": [
        "source"
      ],
      "additionalProperties": false
    },
    "notes": {
      "type": "string"
    }
  },
  "required": [
    "pluginId",
    "displayName",
    "version",
    "type",
    "activeIngredients"
  ],
  "additionalProperties": false
}
