{
  "pluginId": "phydura-clove-citric",
  "type": "herbicide",
  "version": "1.0.2",
  "defaultUnit": "fl-oz",
  "pluginSchemaVersion": "1.1",
  "displayName": "Phydura (clove oil + citric acid)",
  "activeIngredients": [
    {
      "name": "eugenol",
      "chemistryClass": "synthetic-auxin"
    },
    {
      "name": "citric acid",
      "chemistryClass": "synthetic-auxin"
    }
  ],
  "ratePerAcre": {
    "amount": 8,
    "unit": "qt"
  },
  "rateProvenance": "fallback",
  "gpaCalibration": 50,
  "applicationTiming": "POST",
  "requiresAMS": false,
  "deconRequired": false,
  "complianceFlags": {
    "nonGmoCompliant": true
  },
  "notes": "ProGuard botanical contact herbicide. Clove oil eugenol acts as a cell-membrane disruptor. Strong clove odor. chemistryClass tag is nominal."
}