{
  "pluginId": "classic-chlorimuron",
  "type": "herbicide",
  "version": "1.0.1",
  "complianceFlags": {"omriListed": false, "certifiedOrganicAllowed": false, "notes": "No NOP listing on the OMRI Products List (searched 2026-09-25: 'Classic'; 'chlorimuron'). Conventional synthetic herbicide; label carries no organic-production statement."},
  "formulation": "WDG",
  "pluginSchemaVersion": "1.1",
  "displayName": "Classic (chlorimuron-ethyl)",
  "activeIngredients": [
    {
      "name": "chlorimuron-ethyl",
      "chemistryClass": "sulfonylurea"
    }
  ],
  "ratePerAcre": {
    "amount": 0.5,
    "unit": "oz"
  },
  "rateProvenance": "fallback",
  "gpaCalibration": 15,
  "applicationTiming": "POST",
  "requiresAMS": false,
  "deconRequired": true,
  "epaRegistrationNumber": "5481-681",
  "defaultUnit": "oz",
  "notes": "Corteva POST soybean broadleaf herbicide. Group 2 ALS inhibitor. Strong rotation restrictions for sensitive crops."
}