{
  "pluginId": "caparol-prometryn",
  "type": "herbicide",
  "version": "1.0.1",
  "complianceFlags": {"omriListed": false, "certifiedOrganicAllowed": false, "notes": "No NOP listing on the OMRI Products List (searched 2026-09-25: 'Caparol'; 'prometryn'). Conventional synthetic herbicide; label carries no organic-production statement."},
  "defaultUnit": "fl-oz",
  "formulation": "L",
  "pluginSchemaVersion": "1.1",
  "displayName": "Caparol 4L (prometryn)",
  "activeIngredients": [
    {
      "name": "prometryn",
      "chemistryClass": "photosystem-ii-triazine"
    }
  ],
  "ratePerAcre": {
    "amount": 2.4,
    "unit": "pt"
  },
  "rateProvenance": "fallback",
  "gpaCalibration": 15,
  "applicationTiming": "PRE",
  "requiresAMS": false,
  "deconRequired": false,
  "epaRegistrationNumber": "100-620",
  "reEntryIntervalHours": 48,
  "notes": "Syngenta Group 5 PSII triazine PRE for cotton, celery, dill, parsley, fennel, pigeon pea."
}