{
  "pluginId": "method-aminocyclopyrachlor",
  "type": "herbicide",
  "version": "1.0.1",
  "complianceFlags": {"omriListed": false, "certifiedOrganicAllowed": false, "notes": "No NOP listing on the OMRI Products List (searched 2026-09-25: 'Method 240SL'; 'aminocyclopyrachlor'). Conventional synthetic herbicide; label carries no organic-production statement."},
  "defaultUnit": "fl-oz",
  "formulation": "SL",
  "pluginSchemaVersion": "1.1",
  "displayName": "Method 240SL (aminocyclopyrachlor)",
  "activeIngredients": [
    {
      "name": "aminocyclopyrachlor",
      "chemistryClass": "synthetic-auxin"
    }
  ],
  "ratePerAcre": {
    "amount": 5,
    "unit": "fl-oz"
  },
  "rateProvenance": "fallback",
  "gpaCalibration": 15,
  "applicationTiming": "POST",
  "requiresAMS": false,
  "deconRequired": true,
  "epaRegistrationNumber": "101563-177",
  "notes": "Bayer Group 4 synthetic auxin for non-cropland, industrial, and roadside vegetation. Long soil residual; do not use on cropland."
}