{
  "pluginId": "suppress-ec",
  "type": "herbicide",
  "version": "1.0.1",
  "defaultUnit": "fl-oz",
  "formulation": "EC",
  "pluginSchemaVersion": "1.1",
  "displayName": "Suppress EC (caprylic + capric acid, OMRI)",
  "activeIngredients": [
    {
      "name": "caprylic acid",
      "chemistryClass": "synthetic-auxin"
    },
    {
      "name": "capric acid",
      "chemistryClass": "synthetic-auxin"
    }
  ],
  "ratePerAcre": {
    "amount": 6,
    "unit": "qt"
  },
  "rateProvenance": "fallback",
  "gpaCalibration": 75,
  "applicationTiming": "POST",
  "requiresAMS": false,
  "deconRequired": false,
  "epaRegistrationNumber": "51517-9",
  "reEntryIntervalHours": 24,
  "complianceFlags": {
    "omriListed": true,
    "nonGmoCompliant": true,
    "certifiedOrganicAllowed": true,
    "transitioningAllowed": true
  },
  "notes": "Westbridge contact non-selective herbicide. Fatty acid mechanism destroys plant cuticle and membranes on contact. Best in temperatures above 75 F with sunshine. chemistryClass tag is nominal."
}