{
  "pluginId": "raptor-imazamox",
  "type": "herbicide",
  "version": "1.0.1",
  "complianceFlags": {"omriListed": false, "certifiedOrganicAllowed": false, "notes": "No NOP listing on the OMRI Products List (searched 2026-09-25: 'Raptor', 'imazamox'; hits were unrelated products). Label (241-379, accepted 2021-04-30) makes no organic-production claim; conventional synthetic herbicide."},
  "formulation": "SL",
  "defaultUnit": "fl-oz",
  "pluginSchemaVersion": "1.1",
  "displayName": "Raptor (imazamox)",
  "activeIngredients": [
    {
      "name": "imazamox",
      "chemistryClass": "als-imidazolinone"
    }
  ],
  "ratePerAcre": {
    "amount": 5,
    "unit": "fl-oz"
  },
  "rateProvenance": "fallback",
  "gpaCalibration": 15,
  "applicationTiming": "POST",
  "requiresAMS": true,
  "deconRequired": true,
  "epaRegistrationNumber": "241-379",
  "notes": "BASF POST imidazolinone (Group 2 ALS). Standard tool for alfalfa, soybean, dry bean, peas, Clearfield wheat/sunflower.",
  "grazingRestrictions": {
    "grazeDays": 0,
    "hayDays": 0,
    "lactatingDairyGrazeDays": 0,
    "meatAnimalRemovalBeforeSlaughterDays": 0,
    "source": "Raptor herbicide, EPA Reg. No. 241-379, label accepted 2021-04-30"
  }
}
