{
  "pluginId": "harmony-sg-thifensulfuron",
  "type": "herbicide",
  "version": "1.0.1",
  "complianceFlags": {"omriListed": false, "certifiedOrganicAllowed": false, "notes": "No NOP listing on the OMRI Products List (searched 2026-09-25: 'Harmony'; 'thifensulfuron'). Conventional synthetic herbicide; label carries no organic-production statement."},
  "defaultUnit": "oz",
  "formulation": "SG",
  "pluginSchemaVersion": "1.1",
  "grazingRestrictions": {
    "grazeDays": 30,
    "hayDays": 30,
    "lactatingDairyGrazeDays": 30,
    "meatAnimalRemovalBeforeSlaughterDays": 0,
    "source": "Harmony SG herbicide, EPA Reg. No. 279-9595, label accepted 2020-04-17"
  },
  "displayName": "Harmony SG (thifensulfuron)",
  "activeIngredients": [
    {
      "name": "thifensulfuron-methyl",
      "chemistryClass": "sulfonylurea"
    }
  ],
  "ratePerAcre": {
    "amount": 0.5,
    "unit": "oz"
  },
  "rateProvenance": "fallback",
  "gpaCalibration": 15,
  "applicationTiming": "POST",
  "requiresAMS": false,
  "deconRequired": true,
  "epaRegistrationNumber": "279-9595",
  "notes": "FMC POST broadleaf herbicide for soybeans, cereals and field corn; the label has no pasture or rangeland use. Group 2 ALS-inhibitor."
}