{
  "pluginId": "sencor-metribuzin",
  "type": "herbicide",
  "version": "1.0.1",
  "complianceFlags": {"omriListed": false, "certifiedOrganicAllowed": false, "notes": "No NOP listing on the OMRI Products List (searched 2026-09-25: 'Sencor'; 'metribuzin'). Conventional synthetic herbicide; label carries no organic-production statement."},
  "defaultUnit": "lb",
  "formulation": "DF",
  "pluginSchemaVersion": "1.1",
  "displayName": "Sencor 75 DF (metribuzin)",
  "activeIngredients": [
    {
      "name": "metribuzin",
      "chemistryClass": "photosystem-ii-triazine"
    }
  ],
  "gpaCalibration": 15,
  "applicationTiming": "PRE",
  "requiresAMS": false,
  "deconRequired": false,
  "epaRegistrationNumber": "264-738",
  "notes": "Bayer Group 5 PSII triazine for potato, soybean, tomato (transplant), wheat, asparagus. PRE and early POST."
}