{
  "pluginId": "liberty-ultra",
  "type": "herbicide",
  "displayName": "Liberty ULTRA (BASF)",
  "version": "1.0.1",
  "epaRegistrationNumber": "7969-500",
  "reEntryIntervalHours": 12,
  "defaultUnit": "fl-oz",
  "applicationTiming": "POST",
  "activeIngredients": [
    {
      "name": "L-glufosinate ammonium",
      "chemistryClass": "glufosinate"
    }
  ],
  "ratePerAcre": {
    "amount": 24,
    "unit": "fl-oz"
  },
  "rateProvenance": "fallback",
  "gpaCalibration": 15,
  "requiresAMS": true,
  "deconRequired": true,
  "tankMixOrder": 4,
  "notes": "Newer L-isomer formulation — 2× more active per oz than Liberty 280. LibertyLink crops only.",
  "complianceFlags": {
    "omriListed": false,
    "certifiedOrganicAllowed": false,
    "nonGmoCompliant": true,
    "transitioningAllowed": false
  },
  "pluginSchemaVersion": "1.1"
}
