{
  "pluginId": "sharpen-saflufenacil",
  "type": "herbicide",
  "version": "1.0.1",
  "complianceFlags": {"omriListed": false, "certifiedOrganicAllowed": false, "notes": "No NOP listing on the OMRI Products List (searched 2026-09-25: 'Sharpen', 'saflufenacil'; hits were unrelated products). Label (7969-278, accepted 2024-09-10) makes no organic-production claim; conventional synthetic herbicide."},
  "formulation": "SC",
  "defaultUnit": "fl-oz",
  "pluginSchemaVersion": "1.1",
  "displayName": "Sharpen (saflufenacil)",
  "activeIngredients": [
    {
      "name": "saflufenacil",
      "chemistryClass": "ppo-inhibitor"
    }
  ],
  "ratePerAcre": {
    "amount": 1,
    "unit": "fl-oz"
  },
  "rateProvenance": "fallback",
  "gpaCalibration": 15,
  "applicationTiming": "BURNDOWN",
  "requiresAMS": true,
  "deconRequired": false,
  "epaRegistrationNumber": "7969-278",
  "notes": "BASF Group 14 PPO-inhibitor burndown for corn, soybean, wheat. Strong on glyphosate-resistant marestail and pigweed."
}