{
  "pluginId": "spartan-charge",
  "type": "herbicide",
  "displayName": "Spartan Charge (FMC sulfentrazone + carfentrazone)",
  "version": "1.0.1",
  "formulation": "SE",
  "epaRegistrationNumber": "279-3337",
  "defaultUnit": "fl-oz",
  "applicationTiming": "PRE",
  "activeIngredients": [
    {
      "name": "sulfentrazone",
      "chemistryClass": "ppo-inhibitor"
    },
    {
      "name": "carfentrazone-ethyl",
      "chemistryClass": "ppo-inhibitor"
    }
  ],
  "ratePerAcre": {
    "amount": 5,
    "unit": "fl-oz"
  },
  "rateProvenance": "fallback",
  "gpaCalibration": 15,
  "deconRequired": true,
  "tankMixOrder": 4,
  "labelClaims": {
    "safeForCropPluginIds": [
      "soybean-asgrow-roundup-ready-2-xtend"
    ]
  },
  "notes": "PRE PPO premix — soybean + sunflower + dry bean. Burndown + residual.",
  "complianceFlags": {
    "omriListed": false,
    "certifiedOrganicAllowed": false,
    "nonGmoCompliant": true,
    "transitioningAllowed": false
  },
  "pluginSchemaVersion": "1.1"
}
