{
  "pluginId": "crossbow",
  "type": "herbicide",
  "displayName": "Crossbow (Corteva 2,4-D + triclopyr)",
  "version": "1.0.0",
  "epaRegistrationNumber": "62719-260",
  "defaultUnit": "fl-oz",
  "applicationTiming": "POST",
  "activeIngredients": [
    {
      "name": "2,4-D 2-ethylhexyl ester",
      "chemistryClass": "synthetic-auxin"
    },
    {
      "name": "triclopyr butoxyethyl ester",
      "chemistryClass": "synthetic-auxin"
    }
  ],
  "ratePerAcre": {
    "amount": 1.5,
    "unit": "qt"
  },
  "gpaCalibration": 15,
  "deconRequired": true,
  "tankMixOrder": 5,
  "notes": "Brush + woody species control on pasture / fence-line / hay. Highly drift-prone over broadleaves and orchards. Hay PHI applies.",
  "complianceFlags": {
    "omriListed": false,
    "certifiedOrganicAllowed": false,
    "nonGmoCompliant": true,
    "transitioningAllowed": false
  },
  "pluginSchemaVersion": "1.1",
  "grazingRestrictions": {
    "grazeDays": 0,
    "hayDays": 14,
    "lactatingDairyGrazeDays": 365,
    "meatAnimalRemovalBeforeSlaughterDays": 3,
    "manureCarryover": true,
    "manureCarryoverDays": 3,
    "source": "Crossbow herbicide, EPA Reg. No. 62719-260, label amended 02-03-2025 (accepted 2025-02-04)"
  }
}
