{
  "pluginId": "eptam-eptc",
  "type": "herbicide",
  "version": "1.0.1",
  "complianceFlags": {"omriListed": false, "certifiedOrganicAllowed": false, "notes": "No NOP listing on the OMRI Products List (searched 2026-09-25: 'Eptam'; only an unrelated silicone adjuvant returned). Conventional synthetic thiocarbamate (EPTC) herbicide, Gowan Eptam 7-E EPA 10163-283; label makes no organic-production claim."},
  "defaultUnit": "fl-oz",
  "formulation": "EC",
  "pluginSchemaVersion": "1.1",
  "displayName": "Eptam 7E (EPTC)",
  "activeIngredients": [
    {
      "name": "EPTC",
      "chemistryClass": "unclassified"
    }
  ],
  "ratePerAcre": {
    "amount": 3.5,
    "unit": "pt"
  },
  "gpaCalibration": 15,
  "applicationTiming": "PRE",
  "requiresAMS": false,
  "deconRequired": false,
  "epaRegistrationNumber": "10163-283",
  "notes": "Gowan Group 15 thiocarbamate VLCFA inhibitor. Incorporate within 30 min to avoid volatility loss. Strong on yellow nutsedge. chemistryClass is unclassified until its label group is quoted into the sources file (#654), so the safety kernel treats it as lethal to every crop family."
}