{
  "pluginId": "beyond",
  "type": "herbicide",
  "displayName": "Beyond (BASF imazamox)",
  "version": "1.0.1",
  "formulation": "SL",
  "epaRegistrationNumber": "241-441",
  "reEntryIntervalHours": 4,
  "defaultUnit": "fl-oz",
  "applicationTiming": "POST",
  "activeIngredients": [
    {
      "name": "imazamox",
      "chemistryClass": "als-imidazolinone"
    }
  ],
  "ratePerAcre": {
    "amount": 4,
    "unit": "fl-oz"
  },
  "rateProvenance": "fallback",
  "gpaCalibration": 15,
  "deconRequired": true,
  "tankMixOrder": 5,
  "notes": "Clearfield (IMI-traited) crops only — wheat, soybean, dry bean, sunflower. NOT for non-traited crops. Strict label-only use.",
  "complianceFlags": {
    "omriListed": false,
    "certifiedOrganicAllowed": false,
    "nonGmoCompliant": true,
    "transitioningAllowed": false
  },
  "pluginSchemaVersion": "1.1"
}
