{
  "pluginId": "accent-q-nicosulfuron",
  "type": "herbicide",
  "version": "1.0.1",
  "complianceFlags": {"omriListed": false, "certifiedOrganicAllowed": false, "notes": "No NOP listing on the OMRI Products List (searched 2026-09-25: 'Accent Q', 'Accent'). Conventional synthetic sulfonylurea (nicosulfuron) herbicide; label (EPA Reg. 352-773) makes no organic-production claim."},
  "formulation": "WDG",
  "pluginSchemaVersion": "1.1",
  "displayName": "Accent Q (nicosulfuron)",
  "activeIngredients": [
    {
      "name": "nicosulfuron",
      "chemistryClass": "sulfonylurea"
    }
  ],
  "ratePerAcre": {
    "amount": 0.9,
    "unit": "oz"
  },
  "rateProvenance": "fallback",
  "gpaCalibration": 15,
  "applicationTiming": "POST",
  "requiresAMS": true,
  "deconRequired": true,
  "epaRegistrationNumber": "352-773",
  "reEntryIntervalHours": 4,
  "defaultUnit": "oz",
  "notes": "Corteva field corn POST grass and broadleaf product. ALS-inhibitor sulfonylurea. Add AMS and methylated seed oil per label. Apply to corn V1 through V6."
}